date,description,url,featured
2020-01-23,Australian biosecurity officers begin screening arrivals from Wuhan in Sydney.,https://www.smh.com.au/politics/federal/passengers-arriving-from-chinese-virus-city-will-be-screened-in-sydney-20200121-p53t8t.html,0
2020-01-25,"Authorities confirm that three cases in Sydney and one in Melbourne are the first cases of COVID-19 in Australia. Government advises “do not travel” to Hubei province, China.",https://www.theguardian.com/science/2020/jan/25/coronavirus-five-people-in-nsw-being-tested-for-deadly-disease,0
2020-02-02,Hundreds of Australians are evacuated from Wuhan in a repatriation flight. Travellers from China are barred from entering Australia.,https://www.abc.net.au/news/2020-02-03/coronavirus-escaping-australians-evacuated-from-wuhan-on-flight/11922638,0
2020-02-27,"Prime Minister Scott Morrison announces activation of an emergency plan in response to COVID-19, extends travel ban from China. 14-day isolation required for returning Australians.",https://www.abc.net.au/news/2020-02-27/federal-government-coronavirus-pandemic-emergency-plan/12005734,0
2020-03-01,A man from Perth is the first person in Australian to die as a result of COVID-19.,https://7news.com.au/travel/coronavirus/western-australian-man-becomes-first-person-in-australia-to-die-from-coronavirus-c-723547,0
2020-03-02,Sydney has Australia’s first two cases of COVID-19 community transmission.,https://www.theguardian.com/world/2020/mar/02/coronavirus-first-cases-of-community-transmission-confirmed-in-australia,0
2020-03-03,Sydney’s first COVID-19 death is a woman from an aged care facility. Supermarket panic buying begins.,https://www.health.nsw.gov.au/news/Pages/20200304_03.aspx,0
2020-03-12,The Prime Minister announces $17.6 billion stimulus package to protect the economy from the effects of coronavirus.,https://www.pm.gov.au/media/economic-stimulus-package,0
2020-03-15,The New South Wales Health Minister implements a ban on events of more than 500 people.,https://www.health.nsw.gov.au/news/Pages/20200315_02.aspx,0
2020-03-17,The New South Wales Government announces a $2.3 billion health and economic stimulus package.,https://www.nsw.gov.au/media-releases/23-billion-health-boost-and-economic-stimulus,0
2020-03-18,Prime Minister announces a ban on indoor events of more than 100 people and prohibits international travel. Social distancing of 1.5 metres is encouraged. The Govenor-General declares a biosecurity emergency.,https://concreteplayground.com/sydney/travel-leisure/the-australian-government-has-introduced-an-effective-indefinite-ban-on-all-international-travel,0
2020-03-19,"Passengers disembark from the Ruby Princess cruise ship in Sydney, despite many being sick with COVID-19. This error by health authorities was later determined to have caused the spread of 662 coronavirus cases and death of 28.",https://www.abc.net.au/news/2020-08-14/ruby-princess-coronavirus-inquiry-findings-handed-down/12557714,0
2020-03-20,Australian borders close to all non-residents.,https://7news.com.au/lifestyle/health-wellbeing/australia-closes-borders-to-stop-coronavirus-c-752927,0
2020-03-23,"Australia enters stage one lockdown, with all hospitality allowed to offer takeaway only, and shops subject to social distancing guidelines. Non-essential travel is prohibited. NSW Premier encourages parents to keep children home from school. $66 billion in business financial support announced.",https://www.abc.net.au/news/2020-03-23/coronavirus-shutdown-in-australia-whats-open-whats-closed/12081074,1
2020-03-25,"Stage two lockdown in force, with further restrictions on indoor activities, gyms, weddings and funerals.",https://www.abc.net.au/news/2020-03-25/what-is-open-or-closed-in-australia-now-because-of-coronavirus/12087894,0
2020-03-28,"Hotel quarantine program begins, enforcing a two-week stay in a hotel for all new arrivals into Australia.",https://www.abc.net.au/news/2020-03-27/forced-coronavirus-quarantine-for-people-returning-to-australia/12095898,0
2020-03-31,New South Wales bans gatherings of more than two people. Citizens told to cancel plans to travel to regional areas for Easter.,https://www.abc.net.au/news/2020-04-11/coronavirus-what-are-stage-four-restrictions-in-australia/12141480,0
2020-04-21,"NSW Premier announces a phased return to school, from mid-May, for all children who had so far been kept home.",https://www.nsw.gov.au/media-releases/nsw-students-to-transition-back-to-classroom-term-2,0
2020-04-26,Federal government releases the COVIDSafe app which aims to identify possible exposure to COVID-19.,https://www.pm.gov.au/media/covidsafe-new-app-slow-spread-coronavirus,0
2020-05-01,Up to two adults are now allowed to visit another household in New South Wales.,https://www.nsw.gov.au/media-releases/update-on-covid-19-restrictions,0
2020-05-03,NSW Minister for Health Brad Hazzard announces property inspections and on-site auctions may resume.,https://www.nsw.gov.au/news/nsw-ready-to-reopen-front-door-on-property-inspections-and-on-site-auctions,0
2020-05-08,"Prime Minister announces three-step plan “Roadmap to COVIDSafe Australia” for easing coronavirus restrictions, to be implemented by each state independently.",https://www.9news.com.au/national/coronavirus-restrictions-australia-pm-scott-morrison-three-step-plan-to-reopen-country/1a2c571e-51ce-40af-bfdd-ce5375c45554,0
2020-05-15,"NSW’s restrictions ease in line with the federal government roadmap’s first step, including: outdoor gatherings allowed up to 10 people, up to five household visitors allowed, and hospitality venues able to serve ten patrons at a time.",https://www.nsw.gov.au/news/nsw-to-ease-covid-19-restrictions-from-friday-15-may,0
2020-06-01,"Further easing of restrictions in NSW, with hospitality venues allowed to serve 50 people, libraries and museums reopened, travel to regional NSW allowed and up to 50 people allowed to attend church services. More public transport services provided to aid physical distancing.",https://www.nsw.gov.au/news/new-covid-19-restrictions-place-across-nsw,0
2020-06-13,"Gyms and recreational facilities allowed to reopen in NSW, with venue limits.",https://www.nsw.gov.au/news/gyms-and-kids-sports-to-reopen-across-nsw,0
2020-07-01,Kids' sport and community sport resumes in NSW. Capacity increases on public transport.,https://www.nsw.gov.au/news/gyms-and-kids-sports-to-reopen-across-nsw,0
2020-07-04,NSW Health places a cap of 450 on daily arrivals at Sydney Airport to ease pressure on hotel quarantine.,https://www.abc.net.au/news/2020-07-04/nsw-coronavirus-cap-on-arrivals-to-ease-quarantine-pressure/12422504,0
2020-07-06,Off-peak discount of 50% introduced on public transport services in Sydney to incentivise staggered travel and aid social distancing.,https://www.nsw.gov.au/news/half-price-off-peak-travel-on-public-transport,0
2020-07-17,"Restrictions introduced for hospitality venues, with a maximum of 10 at a table and a cap of 300 in a venue at any one time. COVID safe hygiene Marshalls will enforce restrictions with a COVID Safe plan.",https://www.nsw.gov.au/media-releases/tough-new-covid-19-compliance-measures-for-pubs,0
2020-07-24,Restrictions added to limit the size of weddings and corporate events to 150 people; with funerals and worship capped at 100 people.,https://www.nsw.gov.au/news/additional-covid-19-restrictions-place-for-nsw,0
2020-09-24,"Low case numbers prompt easing of restrictions in a school environment, including community sports, camps, music and high school formals allowed.",https://www.nsw.gov.au/news/school-sport-and-music-restrictions-relaxed,0
2020-09-28,"Cinemas and concert venues allowed to increase capacity up to 50%, corporate events cap raised to 300 people.",https://www.nsw.gov.au/news/capacity-increase-for-entertainment-venues,0
2020-10-07,NSW Government announces pilot of outdoor dining in Sydney to encourage patronage of hospitality venues after covid.,https://www.nsw.gov.au/news/sydney-cbd-alfresco-dining-set-to-open,0
2020-10-16,"Trans-Tasman travel bubble begins with New Zealand travellers able to enter Australia without a quarantine period. Capacity doubles in hospitality venues, with one person per two square metres instead of four.",https://www.sbs.com.au/news/emotional-scenes-as-first-no-quarantine-flights-arrive-into-sydney-under-new-trans-tasman-travel-bubble,0
2020-10-23,"Number of people able to gather outdoors increased from 20 to 30, and number at a table in hospitality venues raised from 10 to 30. Limits on gym operation and religious worship ceremonies also eased.",https://www.nsw.gov.au/news/outdoor-gathering-and-hospitality-bookings-to-increase,0
2020-11-18,NSW Government announces “Out and About” scheme to stimulate local dining and entertainment by giving citizens digital vouchers. The scheme is to launch in January 2021.,https://www.nsw.gov.au/news/dine-and-discover-vouchers-to-support-local-economy,0
2020-11-23,"Recording customer information digitally becomes law in NSW, with the Service NSW app available since September.",https://www.nsw.gov.au/news/mandatory-customer-check-for-nsw-venues,0
2020-12-14,Capacity increases on Public Transport across NSW.,https://www.nsw.gov.au/news/public-transport-capacity-to-increase,0
2020-12-18,"A COVID-19 hotspot is declared in Sydney’s northern beaches, prompting the government to instruct residents of the area to work from home and avoid unnecessary gatherings.",https://www.nsw.gov.au/news/new-covid-19-clinics-and-increased-operations-for-northern-beaches,0
2020-12-20,Premier Gladys Berejiklian imposes lockdown restrictions across Sydney including a limit of 10 visitors to homes and the reintroduction for hospitality of the rule of one patron per 4 square metres. Residents of the Northern Beaches are not allowed to leave their area. The use of face masks is encouraged.,https://www.news.com.au/lifestyle/health/health-problems/sydney-cluster-30-new-cases-recorded-after-northern-beaches-outbreak/news-story/4894dac7de6199c50da8614550968108,0
2021-01-01,Sydneysiders limited to gatherings of five indoors and 30 outdoors to celebrate the New Year amid the northern beaches outbreak.,https://www.sbs.com.au/news/australians-welcome-2021-with-fireworks-on-empty-sydney-harbour,0
2021-01-03,"Wearing of face masks becomes compulsory when in certain areas in NSW. Capacity of gyms, worship, weddings, funerals and performance venues are reduced.",https://www.abc.net.au/news/2021-01-02/nsw-coronavirus-the-new-restrictions-in-greater-sydney-explained/13027530,0
2021-01-29,"Restrictions eased as case numbers drop, with masks no longer compulsory. The Premier waits a further two weeks before easing hospitality density limits.",https://www.theage.com.au/national/nsw/things-have-changed-some-restrictions-eased-as-nsw-strikes-balance-20210127-p56x7r.html,0
2021-02-21,"First COVID-19 Vaccine administered in Australia, to a Sydney aged care resident.",https://www.smh.com.au/politics/federal/covid-19-vaccines-begin-as-prime-minister-receives-pfizer-immunisation-20210221-p574cw.html,0
2021-04-19,Cross-Tasman travel bubble now allows no-quarantine flights between Australia and New Zealand in either direction,https://www.abc.net.au/news/2021-04-19/travel-bubble-opens-new-zealand-journey-home/100077854,0
2021-05-06,"After another outbreak in Sydney, restrictions are tightened for four days, with face masks again compulsory and a reduction in social gathering limits.",https://www.abc.net.au/news/2021-05-06/nsw-records-second-positive-covid-case/100119774,0
2021-05-09,Restrictions extended until 17 May as missing links in chain of transmission are still not identified.,https://www.abc.net.au/news/2021-05-09/nsw-records-no-local-covid-cases-restrictions-extended-to-may-17/100126708,0
2021-05-17,Restrictions introduced on May 6 are removed.,https://www.abc.net.au/news/2021-05-17/sydney-news-greater-sydney-covid-19-restrictions-lifted/100142462,0